{
  "schema_version": 1,
  "base": {
    "id": "run-base-fixture",
    "side": "base",
    "created_at": "2026-10-20T10:00:00Z",
    "git": {
      "sha": "1111111111111111111111111111111111111111",
      "ref": "refs/heads/main",
      "dirty": false
    },
    "env": {
      "os": "linux",
      "arch": "amd64",
      "go_version": "go1.23.0",
      "num_cpu": 8,
      "cpu_model": "AMD EPYC",
      "gomaxprocs": 8,
      "hostname": "bench-worker"
    }
  },
  "head": {
    "id": "run-head-fixture",
    "side": "head",
    "created_at": "2026-10-20T10:05:00Z",
    "git": {
      "sha": "2222222222222222222222222222222222222222",
      "ref": "refs/heads/feat",
      "dirty": false
    },
    "env": {
      "os": "linux",
      "arch": "amd64",
      "go_version": "go1.23.0",
      "num_cpu": 8,
      "cpu_model": "AMD EPYC",
      "gomaxprocs": 8,
      "hostname": "bench-worker"
    }
  },
  "items": [
    {
      "benchmark": "BenchmarkProcess",
      "metric": "sec/op",
      "base_median": 100,
      "head_median": 120,
      "delta_pct": 20,
      "ci": [
        20,
        20
      ],
      "p_value": 0.0021645021645021645,
      "cv_base": 0,
      "cv_head": 0,
      "n_base": 6,
      "n_head": 6,
      "status": "fail",
      "reason": "exceeds_fail"
    }
  ],
  "verdict": "fail"
}